929,"Державний вищий навчальний заклад ""Куп'янський автотранспортний коледж""",ДВНЗ КАТК,0,2128371,Державна,Міністерство освіти і науки України,Коледж,ХАРКІВСЬКА ОБЛАСТЬ/М.ХАРКІВ,ХАРКІВСЬКА ОБЛАСТЬ/М.ХАРКІВ, КУП'ЯНСЬК, КУП'ЯНСЬК, 63700: Комсомольська 34,574256605,574256782,katt2003@ukr.net,Деміденко Віктор Володимирович,директор,,,
930,"Криворізький коледж економіки та управління Державного вищого навчального закладу ""Київський національний економічний університет імені Вадима Гетьмана""",,337,193275,Державна,Міністерство освіти і науки України,Відокремлений підрозділ,ДНІПРОПЕТРОВСЬКА ОБЛАСТЬ/М.ДНІПРОПЕТРОВСЬК,ДНІПРОПЕТРОВСЬКА ОБЛАСТЬ/М.ДНІПРОПЕТРОВСЬК, КРИВИЙ РІГ, КРИВИЙ РІГ, 50096: Ватутіна 37-А,(056) 404 69 92, 453 59 92,ktey_metodkab@mail.ru,Прибилович Людмила Анатоліївна, директор,,,
931,Дніпродзержинський економічний коледж Дніпродзержинського державного технічного університету,ДЕК ДДТУ,1254,3062929,Державна,Міністерство освіти і науки України,Відокремлений підрозділ,ДНІПРОПЕТРОВСЬКА ОБЛАСТЬ/М.ДНІПРОПЕТРОВСЬК,ДНІПРОПЕТРОВСЬКА ОБЛАСТЬ/М.ДНІПРОПЕТРОВСЬК, ДНІПРОДЗЕРЖИНСЬК, ДНІПРОВСЬКИЙ, 51918: Дніпробудівська 2,(05692)3-16-41,tet_dgtu@ukr.net,Сітько Віктор Володимирович,директор,,,,
932,Харківський обліково-економічний технікум-інтернат ім. Ф.Г. Ананченка,ХОЕТ ім. Ф.Г. Ананченка,0,3191590,Державна,Міністерство освіти і науки України,Технікум (училище),ХАРКІВСЬКА ОБЛАСТЬ/М.ХАРКІВ,ХАРКІВСЬКА ОБЛАСТЬ/М.ХАРКІВ, ХАРКІВ, ЖОВТНЕВИЙ, 61064: Полтавський шлях 133,573702180,573705184,huet@list.ru,Галкіна Ольга Андріївна,директор,,,
933,Костопільська філія Рівненського державного базового медичного коледжу,КФРДБМК,729,25833244,Комунальна,Обласна рада,Відокремлений підрозділ,РІВНЕНСЬКА ОБЛАСТЬ/М.РІВНЕ,РІВНЕНСЬКА ОБЛАСТЬ/М.РІВНЕ, КОСТОПІЛЬСЬКИЙ РАЙОН/М.КОСТОПІЛЬ, КОСТОПІЛЬ, 35000: М.Грушевського 18,(03657)21154,kost_medcol@ukr.net,Носко Ігор Павлович,завідувач ,,,,
934,Ужгородський заочний факультет Донецької державної музичної академії імені С.С. Прокоф`єва,УЗФДДМА  імені С.С. Прокоф`єва,363,26099390,Державна,Міністерство культури України,Відокремлений підрозділ,ЗАКАРПАТСЬКА ОБЛАСТЬ/М.УЖГОРОД,ЗАКАРПАТСЬКА ОБЛАСТЬ/М.УЖГОРОД, УЖГОРОД, УЖГОРОД, 80000: Волошина 13,062 334 09 28,donmusacademy@ukr.net,Стегней Володимир Васильович,декан,,,,
935,Одеський технічний коледж Одеської національної академії харчових технологій,ОТК ОНАХТ,51,389162,Державна,Міністерство освіти і науки України,Відокремлений підрозділ,ОДЕСЬКА ОБЛАСТЬ/М.ОДЕСА,ОДЕСЬКА ОБЛАСТЬ/М.ОДЕСА, ОДЕСА, ПРИМОРСЬКИЙ, 65110: Балківська 54,048 730 49 00, 730 49 01,otkua@ukr.net,Коваленко Анатолій Володимирович,директор,,,
936,Навчально-консультаційний центр Національного транспортного університету у м. Івано-Франковську,НКЦ НТУ у м.Івано-Франківську,24,35691443,Державна,Міністерство освіти і науки України,Відокремлений підрозділ,ІВАНО-ФРАНКІВСЬКА ОБЛАСТЬ/М.ІВАНО-ФРАНКІВСЬК,ІВАНО-ФРАНКІВСЬКА ОБЛАСТЬ/М.ІВАНО-ФРАНКІВСЬК, ІВАНО-ФРАНКІВСЬК, ІВАНО-ФРАНКІВСЬК, 76000: Красівського 7,(034) 272-10-53,ifnkcntu@gmail.com,Скрипник Василь Степанович,керівник,,,,
937,"Жовтоводське педагогічне училище Державного вищого навчального закладу ""Криворізький національний університет""","ЖПУ ДВНЗ ""КНУ""",919,37861943,Державна,Департамент освіти і науки Дніпропетровської обласної державної адміністрації,Відокремлений підрозділ,ДНІПРОПЕТРОВСЬКА ОБЛАСТЬ/М.ДНІПРОПЕТРОВСЬК,ДНІПРОПЕТРОВСЬКА ОБЛАСТЬ/М.ДНІПРОПЕТРОВСЬК, ЖОВТІ ВОДИ, ЖОВТІ ВОДИ, 52206: Івана Франка 5,(056) 522 54 16,zv_kdpu@ukr.net,Зеленченок Марія Дем'янівна,директор,,,,
938,Прилуцький агротехнічний коледж,Агроколедж,0,729149,Державна,Міністерство освіти і науки України,Коледж,ЧЕРНІГІВСЬКА ОБЛАСТЬ/М.ЧЕРНІГІВ,ЧЕРНІГІВСЬКА ОБЛАСТЬ/М.ЧЕРНІГІВ, ПРИЛУКИ, ПРИЛУКИ, 17500: Київська 178,(04637)32050,gidrotech@ukr.net,Черніков Павло Іванович,виконуючий обов’язки ,,,,
939,"Автотранспортний технікум Державного вищого навчального закладу ""Національний гірничий університет""","Автотранспортний технікум Державного ВНЗ ""НГУ""",36,26461744,Державна,Міністерство освіти і науки України,Відокремлений підрозділ,ДНІПРОПЕТРОВСЬКА ОБЛАСТЬ/М.ДНІПРОПЕТРОВСЬК,ДНІПРОПЕТРОВСЬКА ОБЛАСТЬ/М.ДНІПРОПЕТРОВСЬК, ДНІПРОПЕТРОВСЬК, ДНІПРОПЕТРОВСЬК, 49000: Карла Маркса 19,(056) 749 63 24,atngu@ukr.net,Беседін Вячеслав Леонідович,директор,,,,
940,"Докучаєвський гірничий технікум Державного вищого навчального закладу ""Національний гірничий університет""","ДГТ ДВНЗ ""НГУ""",36,34916858,Державна,Міністерство освіти і науки України,Технікум (училище),ДОНЕЦЬКА ОБЛАСТЬ/М.ДОНЕЦЬК,ДНІПРОПЕТРОВСЬКА ОБЛАСТЬ/М.ДНІПРОПЕТРОВСЬК, ДНІПРОПЕТРОВСЬК, ДНІПРОПЕТРОВСЬК, 49005: Карла Маркса 19,06275-32543,gorniy_tehnikum@mail.ru,Кустов Володимир Васильович,виконуючий обов'язки директора,,,,
941,"Павлоградський технікум Державного вищого навчального закладу ""Національний гірничий університет""","Павлоградський технікум Державного ВНЗ ""НГУ""",36,220026,Державна,Міністерство освіти і науки України,Відокремлений підрозділ,ДНІПРОПЕТРОВСЬКА ОБЛАСТЬ/М.ДНІПРОПЕТРОВСЬК,ДНІПРОПЕТРОВСЬКА ОБЛАСТЬ/М.ДНІПРОПЕТРОВСЬК, ПАВЛОГРАД, ПАВЛОГРАД, 51400: Радянська 63,(05632) 649 58,pvt1@ukr.net,Посунько Людмила Миколаївна,директор,,,,
942,"Державний вищий навчальний заклад ""Макіївський політехнічний коледж""","ДВНЗ ""МПК""",0,1242857,Державна,Міністерство освіти і науки України,Коледж,ДОНЕЦЬКА ОБЛАСТЬ/М.ДОНЕЦЬК,ДОНЕЦЬКА ОБЛАСТЬ/М.ДОНЕЦЬК, МАКІЇВКА, МАКІЇВКА, 86157: Леніна 47,(06232) 6-46-08,politehni4eskiy-koledj@rambler.ru,Багрій Світлана Яківна,Директор,,,,
943,Берегівський медичний коледж,БМК,0,2010735,Комунальна,Обласна рада,Коледж,ЗАКАРПАТСЬКА ОБЛАСТЬ/М.УЖГОРОД,ЗАКАРПАТСЬКА ОБЛАСТЬ/М.УЖГОРОД, БЕРЕГОВЕ, БЕРЕГОВЕ, 90202: Мукачівська 3,(03141) 2 33 54,bereg.med.kol@gmail.com,Продан Марія Іванівна,директор,,,,
945,Кіровський транспортний технікум,КТТ,0,173278,Державна,Міністерство освіти і науки України,Технікум (училище),ЛУГАНСЬКА ОБЛАСТЬ/М.ЛУГАНСЬК,ЛУГАНСЬКА ОБЛАСТЬ/М.ЛУГАНСЬК, КІРОВСЬК, КІРОВСЬК, 93800: Правди 10,(06446) 414 15, ф. 411 87,kirtt@ukrpost.ua,Потапенко Олександр Миколайович,директор,,,
946,"Дніпропетровська філія Вищого навчального закладу ""Університет економіки та права ""КРОК""",,318,25818026,Приватна,Без підпорядкування,Відокремлений підрозділ,ДНІПРОПЕТРОВСЬКА ОБЛАСТЬ/М.ДНІПРОПЕТРОВСЬК,М.КИЇВ, М.КИЇВ, М.КИЇВ, 03113: Лагерна 30-32,0562-36-09-28,ovolovik@bk.ru,Черкавський Олександр Віталійович,директор,,,,
947,Бершадський медичний коледж,БМК,0,2011025,Комунальна,Обласна рада,Коледж,ВІННИЦЬКА ОБЛАСТЬ/М.ВІННИЦЯ,ВІННИЦЬКА ОБЛАСТЬ/М.ВІННИЦЯ, БЕРШАДСЬКИЙ РАЙОН/М.БЕРШАДЬ, БЕРШАДЬ, 24400: Червоноармійська 167,(04352)2-42-44,bmk2014@i.ua,Оніщенко Катерина Миколаївна,директор,,,,
948,Навчально-консультаційний центр Національного транспортного університету у м. Львові,,24,25259242,Державна,Міністерство освіти і науки України,Відокремлений підрозділ,ЛЬВІВСЬКА ОБЛАСТЬ/М.ЛЬВІВ,ЛЬВІВСЬКА ОБЛАСТЬ/М.ЛЬВІВ, ЛЬВІВ, ШЕВЧЕНКІВСЬКИЙ, 79069: Ожинова 5,(032) 295 57 79,lntu@mail.lviv.ua,Дорош Василь Михайлович,керівник НКЦ НТУ,,,,
949,"Державний вищий навчальний заклад ""Луганський будівельний коледж""","ДВНЗ ""ЛБК""",0,1242828,Державна,Міністерство освіти і науки України,Коледж,ЛУГАНСЬКА ОБЛАСТЬ/М.ЛУГАНСЬК,ЛУГАНСЬКА ОБЛАСТЬ/М.ЛУГАНСЬК, ЛУГАНСЬК, ЛУГАНСЬК, 91031: Оборонна 8,0642-618887,lst@mail.dsip.net,Ходирєва Ольга Тимофіївна,директор,,,,
950,"Товариство з обмеженою відповідальністю Медичний коледж ""Монада""","ТзОВ медичний коледж ""Монада""",0,13797632,Приватна,Без підпорядкування,Коледж,ЛЬВІВСЬКА ОБЛАСТЬ/М.ЛЬВІВ,ЛЬВІВСЬКА ОБЛАСТЬ/М.ЛЬВІВ, ЛЬВІВ, ЗАЛІЗНИЧНИЙ, 79040: Патона 22-А,(0322) 693 951, 693 952,monadalviv@gmail.com,Гайдучок Ігор Григорович,директор,,,
951,Артемівське музичне училище імені Івана Карабиця,АМУ ім. І.Карабиця,0,2214567,Комунальна,Управління (головне управління) культури обласної державної адміністрації,Технікум (училище),ДОНЕЦЬКА ОБЛАСТЬ/М.ДОНЕЦЬК,ДОНЕЦЬКА ОБЛАСТЬ/М.ДОНЕЦЬК, АРТЕМІВСЬК, АРТЕМІВСЬК, 84500: Лермонтова 12,(0627)445205,509831656,ArtMU@ukr.net,Паржицький Вячеслав Вячеславович, директор,,,
952,Кременецький лісотехнічний коледж,КЛТК,0,994006,Державна,Міністерство освіти і науки України,Коледж,ТЕРНОПІЛЬСЬКА ОБЛАСТЬ/М.ТЕРНОПІЛЬ,ТЕРНОПІЛЬСЬКА ОБЛАСТЬ/М.ТЕРНОПІЛЬ, КРЕМЕНЕЦЬКИЙ РАЙОН/М.КРЕМЕНЕЦЬ, БІЛОКРИНИЦЯ, 47013: Молодіжна ,(03546) 523 70, 523 11, 524 04,kltk1892@gmail.com,Ляховець Микола Володимирович,директор,,
953,"Коледж хореографічного мистецтва ""Київська муніципальна академія танцю імені Сержа Лифаря""",КМАТ імені Сержа Лифаря,0,30382088,Комунальна,Виконавчий орган Київської міської ради (Київська міська державна адміністрація),Технікум (училище),М.КИЇВ,М.КИЇВ, ДЕСНЯНСЬКИЙ, ДЕСНЯНСЬКИЙ, 02232: Данькевича 4-А,(044) 5308757; 5354425,INFO@dance-academy.com.ua,Лягущенко Андрій Геннадійович,директор,,,,
954,"Відокремлений підрозділ Національного університету біоресурсів і природокористування України ""Ірпінський економічний коледж""","ВП НУБіП України ""Ірпінський економічний коледж""",7,33295386,Державна,Міністерство освіти і науки України,Відокремлений підрозділ,КИЇВСЬКА ОБЛАСТЬ/М.КИЇВ,КИЇВСЬКА ОБЛАСТЬ/М.КИЇВ, ІРПІНЬ, ІРПІНЬ, 08200: Гагаріна 9,459762003,iek@irpin.com,Михайлов Сергій Іванович,директор,,,,
955,Львівська філія Дніпропетровського національного університету залізничного транспорту імені академіка В. Лазаряна,,280,33338211,Державна,Міністерство освіти і науки України,Відокремлений підрозділ,ЛЬВІВСЬКА ОБЛАСТЬ/М.ЛЬВІВ,ЛЬВІВСЬКА ОБЛАСТЬ/М.ЛЬВІВ, ЛЬВІВ, ЗАЛІЗНИЧНИЙ, 79052: Іванни Блажкевич 12-А,0322 267 04 86, 226 01 47,lfdiit@ukr.net,Довганюк Степан Степанович,директор,,,
956,"Державний вищий навчальний заклад ""Київський транспортно-економічний коледж"" Національного транспортного університету","ДВНЗ ""КТЕК"" НТУ",24,38488246,Державна,Міністерство освіти і науки України,Відокремлений підрозділ,М.КИЇВ,М.КИЇВ, ГОЛОСІЇВСЬКИЙ, ГОЛОСІЇВСЬКИЙ, 03040: Васильківська 20,(044) 257 23 38, (044) 257 23 95,ktek@ktek.kiev.ua,Шульга Наталія Дмитрівна,директор,,,
957,"Комунальний вищий навчальний заклад Київської обласної ради ""Чорнобильський медичний коледж""","КВНЗ КОР ""Чорнобильський медичний коледж""",0,2011344,Комунальна,Управління (головне управління) охорони здоров`я обласної державної адміністрації,Коледж,КИЇВСЬКА ОБЛАСТЬ/М.КИЇВ,КИЇВСЬКА ОБЛАСТЬ/М.КИЇВ, ЯГОТИНСЬКИЙ РАЙОН/М.ЯГОТИН, ЯГОТИН, 07700: Вокзальна 2,(04575) 5 48 42,meduch@ukrpack.net,Сосюкало Микола Петрович,директор,,,,
958,Новоушицький коледж Подільського державного аграрно-технічного університету,НК ПДПТУ,177,34114840,Державна,Міністерство освіти і науки України,Відокремлений підрозділ,ХМЕЛЬНИЦЬКА ОБЛАСТЬ/М.ХМЕЛЬНИЦЬКИЙ,ХМЕЛЬНИЦЬКА ОБЛАСТЬ/М.ХМЕЛЬНИЦЬКИЙ, НОВОУШИЦЬКИЙ РАЙОН/СМТ НОВА УШИЦЯ, НОВА УШИЦЯ, 36200: Подільська 34,0384 73 00 67,ntpu_@ukrpost.ua,Альльонов Олександр Михайлович,директор,,,,
959,"Відокремлений структурний підрозділ ""Комсомольський індустріальний технікум Державного вищого навчального закладу ""Приазовський державний технічний університет""",КІТ ПДТУ,42,35841244,Державна,Міністерство освіти і науки України,Відокремлений підрозділ,ДОНЕЦЬКА ОБЛАСТЬ/М.ДОНЕЦЬК,ДОНЕЦЬКА ОБЛАСТЬ/М.ДОНЕЦЬК, СТАРОБЕШІВСЬКИЙ РАЙОН/СМТ СТАРОБЕШЕВЕ, КОМСОМОЛЬСЬКЕ, 87250: Маяковського 9,(06253) 5 25 56, 5 21 01,kitkoms@ukrpost.ua,Каненко Олександр Васильович,директор,,,
960,Хустський технічний коледж Товариства сприяння оборони України,ХУСТЕК ТСОУ,0,2724481,Приватна,Департамент освіти і науки Закарпатської обласної державної адміністрації,Коледж,ЗАКАРПАТСЬКА ОБЛАСТЬ/М.УЖГОРОД,ЗАКАРПАТСЬКА ОБЛАСТЬ/М.УЖГОРОД, ХУСТ, ХУСТ, 90400: Львівська 239,(03142) 5-40-13,khustek@ukr.net,Яськів Михайло Миколайович,директор,,,,
961,Київський коледж міського господарства Академії муніципального управління,ККМГАМУ,152,26477001,Державна,Міністерство освіти і науки України,Відокремлений підрозділ,М.КИЇВ,М.КИЇВ, ПЕЧЕРСЬКИЙ, ПЕЧЕРСЬКИЙ, 01601: Івана Кудрі 33, корпус 1,(044) 529-02-06,koledg@amu.edu.ua,Романова Маргарита Іванівна,директор,,,
962,Полтавська філія Національного університету харчових технологій,ПФ НУХТ,47,26026341,Державна,Міністерство освіти і науки України,Відокремлений підрозділ,ПОЛТАВСЬКА ОБЛАСТЬ/М.ПОЛТАВА,ПОЛТАВСЬКА ОБЛАСТЬ/М.ПОЛТАВА, ПОЛТАВА, КИЇВСЬКИЙ, 36039: Пушкіна 56,05322 2 05 93,pzfnucht@ukr.net,Ястреба Сергій Петрович,директор,,,,
963,Шепетівський коледж Подільського державного аграрно-технічного університету,Шепетівський коледж ПДАТУ,177,34363226,Державна,Міністерство освіти і науки України,Відокремлений підрозділ,ХМЕЛЬНИЦЬКА ОБЛАСТЬ/М.ХМЕЛЬНИЦЬКИЙ,ХМЕЛЬНИЦЬКА ОБЛАСТЬ/М.ХМЕЛЬНИЦЬКИЙ, ШЕПЕТІВКА, ШЕПЕТІВКА, 30400: Миру 25,0384052507; 51299,shep_teh@ukrpost.ua,Тетеря Ігор Анатолійович,директор,,,,
964,Одеський автомобільно - дорожній коледж Одеського національного політехнічного університету,ОАДК ОНПУ,203,3450732,Державна,Міністерство освіти і науки України,Відокремлений підрозділ,ОДЕСЬКА ОБЛАСТЬ/М.ОДЕСА,ОДЕСЬКА ОБЛАСТЬ/М.ОДЕСА, ОДЕСА, ПРИМОРСЬКИЙ, 65045: Тираспольська 6,487265858,oadt@ukr.net,Мироненко Сергій Володимирович,директор,,,,
965,Луганське обласне медичне училище,,0,21792755,Комунальна,Міністерство охорони здоров`я України,Технікум (училище),ЛУГАНСЬКА ОБЛАСТЬ/М.ЛУГАНСЬК,ЛУГАНСЬКА ОБЛАСТЬ/М.ЛУГАНСЬК, ЛУГАНСЬК, ЛУГАНСЬК, 91016: Советська 70,(0642) 58-05-20,p_lmu@net.lg.ua,Стародубцев Олександр Петрович,директор,,,,
966,Міжгірський медичний коледж,,0,2010729,Комунальна,Обласна рада,Коледж,ЗАКАРПАТСЬКА ОБЛАСТЬ/М.УЖГОРОД,ЗАКАРПАТСЬКА ОБЛАСТЬ/М.УЖГОРОД, МІЖГІРСЬКИЙ РАЙОН/СМТ МІЖГІР'Я, МІЖГІР'Я, 90000: Шевченка 82,314621576,medkoledg@meta.ua,Івлєва Вікторія Володимирівна,директор,,,,
967,Рівненське музичне училище Рівненського державного гуманітарного університету,,40,25736883,Державна,Міністерство освіти і науки України,Відокремлений підрозділ,РІВНЕНСЬКА ОБЛАСТЬ/М.РІВНЕ,РІВНЕНСЬКА ОБЛАСТЬ/М.РІВНЕ, РІВНЕ, РІВНЕ, 33028: Степана Бандери 6,(0362)63-39-46,rmu-rdgu@ukr.net,Бортнік Анатолій Сергійович,директор,,,,
968,Зборівський коледж Тернопільського національного технічного університету імені Івана Пулюя,ЗК ТНТУ,166,21156189,Державна,Міністерство освіти і науки України,Відокремлений підрозділ,ТЕРНОПІЛЬСЬКА ОБЛАСТЬ/М.ТЕРНОПІЛЬ,ТЕРНОПІЛЬСЬКА ОБЛАСТЬ/М.ТЕРНОПІЛЬ, ЗБОРІВСЬКИЙ РАЙОН/М.ЗБОРІВ, ЗБОРІВ, 47201: Б. Хмельницького 57,(03540) 2-11-30,zborivcollege@ukr.net,Матвіїшин Анатолій Йосипович,директор,,,,
969,"Комунальний вищий навчальний заклад Полтавської обласної ради ""Полтавське музичне училище ім. М.В. Лисенка""",Полтавське музичне училище ім. М.В.Лисенка,0,2214277,Комунальна,Міністерство культури України,Технікум (училище),ПОЛТАВСЬКА ОБЛАСТЬ/М.ПОЛТАВА,ПОЛТАВСЬКА ОБЛАСТЬ/М.ПОЛТАВА, ПОЛТАВА, ОКТЯБРСЬКИЙ, 36020: Жовтнева 11,532562691,poltavamusic@ukr.net,Демченко Микола Миколайович,директор,,,,
970,Кіцманський технікум Подільського державного аграрно-технічного університету,КТПДАТУ,177,34639115,Державна,Міністерство освіти і науки України,Технікум (училище),ЧЕРНІВЕЦЬКА ОБЛАСТЬ/М.ЧЕРНІВЦІ,ЧЕРНІВЕЦЬКА ОБЛАСТЬ/М.ЧЕРНІВЦІ, КІЦМАНСЬКИЙ РАЙОН/М.КІЦМАНЬ, КІЦМАНЬ, 59300: Миколайчука 3,2-36-77,kdat@ukr.net,Філіпчук Юрій Михайлович,директор,,,,
971,"Броварський коледж вищого навчального закладу ""Відкритий міжнародний університет розвитку людини ""Україна""",,217,25772100,Приватна,Без підпорядкування,Коледж,КИЇВСЬКА ОБЛАСТЬ/М.КИЇВ,М.КИЇВ, М.КИЇВ, М.КИЇВ, 04071: Хорива 1-г,444288156,office@vmurol.com.ua,Сніжко Наталія Анатоліївна,директор,,,,
