1541,"Відокремлений підрозділ ""Кримський факультет менеджменту і бізнесу Київського університету культури""",,310,26383530,Приватна,Без підпорядкування,Відокремлений підрозділ,АВТОНОМНА РЕСПУБЛІКА КРИМ/М.СІМФЕРОПОЛЬ,АВТОНОМНА РЕСПУБЛІКА КРИМ/М.СІМФЕРОПОЛЬ, СІМФЕРОПОЛЬ, КИЇВСЬКИЙ, 95034: Івана Франка 6,,,Антюфрієв Микола Борисович,,,,,
1543,Маріупольський навчально-консультаційний центр  Донецького національного університету економіки і торгівлі імені Михайла Туган-Барановського,,135,25928625,Державна,Міністерство освіти і науки України,Відокремлений підрозділ,ДОНЕЦЬКА ОБЛАСТЬ/М.ДОНЕЦЬК,ДОНЕЦЬКА ОБЛАСТЬ/М.ДОНЕЦЬК, МАРІУПОЛЬ, ЖОВТНЕВИЙ, 87528: Матросова 7,629343382,mukc.mar@meta.ua,Колодяжна Ірина Вікторівна,в.о. директора,,,,
1547,Луганський навчальний центр Донецького національного університету економіки і торгівлі імені Михайла Туган-Барановського,,135,26349898,Державна,Міністерство освіти і науки України,Відокремлений підрозділ,ЛУГАНСЬКА ОБЛАСТЬ/М.ЛУГАНСЬК,ЛУГАНСЬКА ОБЛАСТЬ/М.ЛУГАНСЬК, ЛУГАНСЬК, ЛУГАНСЬК, 91055: Советська 44,642522347,lnc@ukr.net,Яровий Володимир Михайлович,в.о. директора,,,,
1548,"Структурний підрозділ ""Коледж конструювання одягу"" Приватного вищого навчального закладу ""Вінницький інститут конструювання одягу і підприємництва""",,1387,36150571,Приватна,Без підпорядкування,Коледж,ВІННИЦЬКА ОБЛАСТЬ/М.ВІННИЦЯ,ВІННИЦЬКА ОБЛАСТЬ/М.ВІННИЦЯ, ВІННИЦЯ, ЛЕНІНСЬКИЙ, 21021: Космонавтів 7,,,Мізрах Аркадій Ананійович,директор,,,,
1550,Криворізький навчальний центр Донецького національного університету економіки і торгівлі імені Михайла Туган-Барановського,,135,26236361,Державна,Міністерство освіти і науки України,Відокремлений підрозділ,ДНІПРОПЕТРОВСЬКА ОБЛАСТЬ/М.ДНІПРОПЕТРОВСЬК,ДНІПРОПЕТРОВСЬКА ОБЛАСТЬ/М.ДНІПРОПЕТРОВСЬК, КРИВИЙ РІГ, КРИВИЙ РІГ, 50042: Курчатова 13,564652815,kdket@yandex.ru,Резниченко Наталія Михайлівна,в.о. директора,,,,
1551,"Відокремлений підрозділ ""Запорізький факультет менеджменту і бізнесу Київського університету культури""",Запорізький факультет М і Б КУК,310,26520300,Приватна,Без підпорядкування,Відокремлений підрозділ,ЗАПОРІЗЬКА ОБЛАСТЬ/М.ЗАПОРІЖЖЯ,ЗАПОРІЗЬКА ОБЛАСТЬ/М.ЗАПОРІЖЖЯ, ЗАПОРІЖЖЯ, ЛЕНІНСЬКИЙ, 69107: Медична 8,061 224 85 77, (044) 284 64 04,,Юдов Микола Олександрович,декан,,,
1552,"""Дніпропетровський коледж Київського університету культури""",,310,39686416,Приватна,Без підпорядкування,Коледж,ДНІПРОПЕТРОВСЬКА ОБЛАСТЬ/М.ДНІПРОПЕТРОВСЬК,ДНІПРОПЕТРОВСЬКА ОБЛАСТЬ/М.ДНІПРОПЕТРОВСЬК, ДНІПРОПЕТРОВСЬК, ДНІПРОПЕТРОВСЬК, 49070: Карла Лібкнехта 9,(044)2846404,567444623,kuk_kiev@ukr.net,Верховенко Ольга Анатоліївна,директор,,,
1553,Ужгородський коледж Київського університету культури,,310,33301195,Приватна,Без підпорядкування,Коледж,ЗАКАРПАТСЬКА ОБЛАСТЬ/М.УЖГОРОД,ЗАКАРПАТСЬКА ОБЛАСТЬ/М.УЖГОРОД, УЖГОРОД, УЖГОРОД, 88015: Минайська 38/80,312662180,,Хомченко Людмила Василівна,директор,,,,
1554,Хмельницький обласний інститут післядипломної педагогічної освіти,Хмельницький обласний інститут післядипломної педагогічної освіти,0,2139802,Комунальна,Обласна рада,Інститут,ХМЕЛЬНИЦЬКА ОБЛАСТЬ/М.ХМЕЛЬНИЦЬКИЙ,ХМЕЛЬНИЦЬКА ОБЛАСТЬ/М.ХМЕЛЬНИЦЬКИЙ, ХМЕЛЬНИЦЬКИЙ, ХМЕЛЬНИЦЬКИЙ, 29027: Озерна 14,(0382) 77 63 20,hmoippo@i.ua,Берека Віктор Євгенович,ректор,,,,
1555,Черкаський факультет менеджменту і бізнесу Київського університету культури,Черкаський факультет МіБ КУК,310,26520292,Приватна,Без підпорядкування,Відокремлений підрозділ,ЧЕРКАСЬКА ОБЛАСТЬ/М.ЧЕРКАСИ,ЧЕРКАСЬКА ОБЛАСТЬ/М.ЧЕРКАСИ, ЧЕРКАСИ, СОСНІВСЬКИЙ, 18000: Благовісна 130/1,472325314,442846404,,Горбатова Надія Олександрівна,декан,,,
1557,Ужгородський факультет менеджменту і бізнесу Київського університету культури,Ужгородський факультет М і Б КУК,310,33301195,Приватна,Без підпорядкування,Відокремлений підрозділ,ЗАКАРПАТСЬКА ОБЛАСТЬ/М.УЖГОРОД,ЗАКАРПАТСЬКА ОБЛАСТЬ/М.УЖГОРОД, УЖГОРОД, УЖГОРОД, 88015: Минайська 38/80,(031)2662180,  (044)2846404,,Вишневська Галина Георгіївна,декан,,,
1558,Кіровоградський коледж Київського університету культури,,310,26519219,Приватна,Без підпорядкування,Коледж,КІРОВОГРАДСЬКА ОБЛАСТЬ/М.КІРОВОГРАД,КІРОВОГРАДСЬКА ОБЛАСТЬ/М.КІРОВОГРАД, КІРОВОГРАД, ЛЕНІНСЬКИЙ, 25006: Василевський 16,(052)2333460,2846404,kuk_kiev@ukr.net,Коптьолов Олександр Іванович,директор,,,
1559,"Відокремлений підрозділ ""Дніпропетровський факультет менеджменту і бізнесу Київського університету культури""",Дніпропетровський факультет М і Б КУК,310,26437303,Приватна,Без підпорядкування,Відокремлений підрозділ,ДНІПРОПЕТРОВСЬКА ОБЛАСТЬ/М.ДНІПРОПЕТРОВСЬК,ДНІПРОПЕТРОВСЬКА ОБЛАСТЬ/М.ДНІПРОПЕТРОВСЬК, ДНІПРОПЕТРОВСЬК, БАБУШКІНСЬКИЙ, 49070: Карла Лібкнехта 9,567442465,44285,kuk_kiev@ukr.net,Вакуленко Олеся Михайлівна,декан,,,
1560,Коледж Донецької академії перукарського мистецтва Київського університету культури,,310,26384340,Приватна,Без підпорядкування,Коледж,ЗАПОРІЗЬКА ОБЛАСТЬ/М.ЗАПОРІЖЖЯ,ЗАПОРІЗЬКА ОБЛАСТЬ/М.ЗАПОРІЖЖЯ, ЗАПОРІЖЖЯ, ЛЕНІНСЬКИЙ, 69096: Медична 8,(044) 284-64-04, (044) 285-30-83,kuk_kiev@ukr.net,Чмарина Людмила Опанасівна,директор,,,
1561,Українська академія перукарської майстерності та декоративної косметики Київського університету культури,Українська академія ПМ ДК КУК,310,26254399,Приватна,Без підпорядкування,Відокремлений підрозділ,М.КИЇВ,М.КИЇВ, ПЕЧЕРСЬКИЙ, ПЕЧЕРСЬКИЙ, 01133: Щорса  36 Б,(044)2846404; 5853740,kuk_kiev@ukr.net,Дихнич Людмила Петрівна,директор,,,,
1562,"Відокремлений підрозділ ""Донецька академія перукарського мистецтва Київського університету культури""",Донецька академія перукарського мистецтва КУК,310,26384363,Приватна,Без підпорядкування,Академія,ЗАПОРІЗЬКА ОБЛАСТЬ/М.ЗАПОРІЖЖЯ,ЗАПОРІЗЬКА ОБЛАСТЬ/М.ЗАПОРІЖЖЯ, ЗАПОРІЖЖЯ, ЛЕНІНСЬКИЙ, 69096: Медична 8,623489294,,Чмарина Вікторія Володимирівна,ректор,,,,
1563,Коледж Приватного вищого навчального закладу Івано-Франківського університету права імені Короля Данила Галицького,,144,37410081,Приватна,Без підпорядкування,Відокремлений підрозділ,ІВАНО-ФРАНКІВСЬКА ОБЛАСТЬ/М.ІВАНО-ФРАНКІВСЬК,ІВАНО-ФРАНКІВСЬКА ОБЛАСТЬ/М.ІВАНО-ФРАНКІВСЬК, ІВАНО-ФРАНКІВСЬК, ІВАНО-ФРАНКІВСЬК, 76018: Євгена Коновальця 35 корпус 1,(0342) 71 66 75,college.iful@email.ua,Луцький Андрій Іванович,ректор,,,,
1564,"Відокремлений підрозділ ""Львівський факультет менеджменту і бізнесу Київського університету культури""",Львівський факультет М і Б КУК,310,26408448,Приватна,Без підпорядкування,Відокремлений підрозділ,ЛЬВІВСЬКА ОБЛАСТЬ/М.ЛЬВІВ,ЛЬВІВСЬКА ОБЛАСТЬ/М.ЛЬВІВ, ЛЬВІВ, ШЕВЧЕНКІВСЬКИЙ, 79019: Кушевича 5,322521289, (044) 284-64-04,,Наконечний Володимир Михайлович,,,,
1566,"Відокремлений підрозділ ""Миколаївський факультет менеджменту і бізнесу Київського університету культури""",Миколаївський факультет М і Б КУК,310,33301132,Приватна,Без підпорядкування,Відокремлений підрозділ,МИКОЛАЇВСЬКА ОБЛАСТЬ/М.МИКОЛАЇВ,МИКОЛАЇВСЬКА ОБЛАСТЬ/М.МИКОЛАЇВ, МИКОЛАЇВ, ЗАВОДСЬКИЙ, 54019: Дачна 7-А,(044)2846404,512428125,,Обозна Альона Олексіївна,декан,,,
1567,Донецький коледж Київського університету культури,,310,33301939,Приватна,Без підпорядкування,Коледж,ЗАПОРІЗЬКА ОБЛАСТЬ/М.ЗАПОРІЖЖЯ,ЗАПОРІЗЬКА ОБЛАСТЬ/М.ЗАПОРІЖЖЯ, ЗАПОРІЖЖЯ, ЗАПОРІЖЖЯ, 69096: Медична 8,(044) 284-64-04, (044) 285-30-83,kuk_kiev@ukr.net,Грищенко Ігор Миколайович,директор,,,
1568,Кримський коледж Київського університету культури,,310,26383530,Приватна,Без підпорядкування,Коледж,АВТОНОМНА РЕСПУБЛІКА КРИМ/М.СІМФЕРОПОЛЬ,АВТОНОМНА РЕСПУБЛІКА КРИМ/М.СІМФЕРОПОЛЬ, СІМФЕРОПОЛЬ, СІМФЕРОПОЛЬ, І.Франка 6,,,  ,,,,,
1569,"""Одеський коледж Київського університету культури""",,310,39686840,Приватна,Без підпорядкування,Коледж,ОДЕСЬКА ОБЛАСТЬ/М.ОДЕСА,ОДЕСЬКА ОБЛАСТЬ/М.ОДЕСА, ОДЕСА, МАЛИНОВСЬКИЙ, 65017: Авіаційна 18,044-284-64-04, 048-776-25-97,kuk_kiev@ukr.net,Проноза Інна Іванівна,директор,,,
1571,"Відокремлений підрозділ ""Донецький факультет менеджменту і бізнесу Київського університету культури""",Донецький факультет М і Б КУК,310,33301939,Приватна,Без підпорядкування,Відокремлений підрозділ,ЗАПОРІЗЬКА ОБЛАСТЬ/М.ЗАПОРІЖЖЯ,ЗАПОРІЗЬКА ОБЛАСТЬ/М.ЗАПОРІЖЖЯ, ЗАПОРІЖЖЯ, ЛЕНІНСЬКИЙ, 69096: Медична 8,(044)284-64-04, 285-30-83,kuk_kiev@ukr.net,Кушнарьов Валерій Володимирович,декан,,,
1572,Черкаський коледж Київського університету культури,,310,26520292,Приватна,Без підпорядкування,Коледж,ЧЕРКАСЬКА ОБЛАСТЬ/М.ЧЕРКАСИ,ЧЕРКАСЬКА ОБЛАСТЬ/М.ЧЕРКАСИ, ЧЕРКАСИ, СОСНІВСЬКИЙ, 18000: Благовісна 130/1,(044)284-64-04, (047)236-11-14,,Ковальчук Таміла Григорівна,директор,,,
1573,"Джанкойський навчально-консультаційний пункт Республіканського вищого навчального закладу ""Кримський інженерно-педагогічний університет"" (м.Джанкой)",,338,26401104,Комунальна,Міністерство освіти і науки, молоді та спорту Автономної Республіки Крим,Відокремлений підрозділ,АВТОНОМНА РЕСПУБЛІКА КРИМ/М.СІМФЕРОПОЛЬ,Для не резидентів, Для не резидентів, Для не резидентів,  ,,,  ,,,,
1574,"Відокремлений підрозділ ""Одеський факультет менеджменту і бізнесу Київського університету культури""",Одеський факультет  М і Б КУК,310,26408431,Приватна,Без підпорядкування,Відокремлений підрозділ,ОДЕСЬКА ОБЛАСТЬ/М.ОДЕСА,ОДЕСЬКА ОБЛАСТЬ/М.ОДЕСА, ОДЕСА, МАЛИНОВСЬКИЙ, 65017: Авіаційна 18,044-284-64-04,487762597,,Мельник Мирослава Миколаївна,декан,,,
1576,"Керченський навчально-консультаційний пункт Республіканського вищого навчального закладу ""Кримський інженерно-педагогічний університет"" (м.Сімферополь)",,338,26442586,Комунальна,Міністерство освіти і науки, молоді та спорту Автономної Республіки Крим,Відокремлений підрозділ,АВТОНОМНА РЕСПУБЛІКА КРИМ/М.СІМФЕРОПОЛЬ,Для не резидентів, Для не резидентів, Для не резидентів,  ,,,  ,,,,
1577,Кіровоградський факультет менеджменту і бізнесу Київського університету культури,Кіровоградський факультет М і Б КУК,310,26519219,Приватна,Без підпорядкування,Відокремлений підрозділ,КІРОВОГРАДСЬКА ОБЛАСТЬ/М.КІРОВОГРАД,КІРОВОГРАДСЬКА ОБЛАСТЬ/М.КІРОВОГРАД, КІРОВОГРАД, ЛЕНІНСЬКИЙ, 25006: Васильківський 16,(052)232 30 75,,Дмитрук Віталій Іванович,декан,,,,
1578,"Коледж при Кіровоградському інституті Приватного акціонерного товариства ""Вищий навчальний заклад ""Міжрегіональна академія управління персоналом""","Коледж при Кіровоградському інституті ПрАТ ""ВНЗ"" ""МАУП""",249,36376352,Приватна,Без підпорядкування,Відокремлений підрозділ,КІРОВОГРАДСЬКА ОБЛАСТЬ/М.КІРОВОГРАД,КІРОВОГРАДСЬКА ОБЛАСТЬ/М.КІРОВОГРАД, КІРОВОГРАД, КІРОВОГРАД, 25026: Варшавська 2,,,Колісніченко Роман Миколайович,директор,,,,
1589,"Навчально-консультаційний пункт з дистанційної освіти Національного аерокосмічного університету ім. М.Є. Жуковського ""Харківський авіаційний інститут"" у м. Новомосковськ",УКП Новомосковськ,34,26369671,Державна,Міністерство освіти і науки України,Відокремлений підрозділ,ДНІПРОПЕТРОВСЬКА ОБЛАСТЬ/М.ДНІПРОПЕТРОВСЬК,Для не резидентів, Для не резидентів, Для не резидентів,  ,,,  ,,,,,
1590,"Навчально-консультаційний пункт факультету № 9 Національного аерокосмічного університету ім. М.Є. Жуковського ""ХАІ""  у м. Київ",,34,26345802,Державна,Міністерство освіти і науки України,Відокремлений підрозділ,М.КИЇВ,М.КИЇВ, М.КИЇВ, М.КИЇВ, 03062: Перемоги 100,,,  ,,,,,
1591,"Уманська філія Приватного вищого навчального закладу "" Київського інституту бізнесу та технологій"" товариство з обмеженою відповідальністю",,289,26357917,Приватна,Без підпорядкування,Відокремлений підрозділ,ЧЕРКАСЬКА ОБЛАСТЬ/М.ЧЕРКАСИ,ЧЕРКАСЬКА ОБЛАСТЬ/М.ЧЕРКАСИ, УМАНЬ, УМАНЬ, 20300: Клари Цеткін 2,(04744)428-20, 350-44, 300-28,info_ym@kibit.edu.ua,Атаманчук Юрій Миколайович,,,
1592,Навчально-консультаційний пункт м. Івано-Франківськ,,240,39252950,Державна,Міністерство внутрішніх справ України,Відокремлений підрозділ,ІВАНО-ФРАНКІВСЬКА ОБЛАСТЬ/М.ІВАНО-ФРАНКІВСЬК,ІВАНО-ФРАНКІВСЬКА ОБЛАСТЬ/М.ІВАНО-ФРАНКІВСЬК, ІВАНО-ФРАНКІВСЬК, ІВАНО-ФРАНКІВСЬК, 76005: Національної гвардії 14-В,,,Питльований Павло Михайлович,завідувач,,,,
1593,Навчально-консультаційний центр Харківського національного університету радіоелектроніки м. Донецьк,,92,33122756,Державна,Міністерство освіти і науки України,Відокремлений підрозділ,ДОНЕЦЬКА ОБЛАСТЬ/М.ДОНЕЦЬК,ДОНЕЦЬКА ОБЛАСТЬ/М.ДОНЕЦЬК, ДОНЕЦЬК, КАЛІНІНСЬКИЙ, 83062: Ткаченка 104,,,Захлєбіна Людмила Євгенівна,,,,,
1594,"Білоцерківський центр дистанційно-заочного навчання Вищого навчального закладу ""Східноєвропейський університет економіки і менеджменту"" (у формі Товариства з обмеженою відповідальністю)",,255,26376286,Приватна,Без підпорядкування,Відокремлений підрозділ,КИЇВСЬКА ОБЛАСТЬ/М.КИЇВ,КИЇВСЬКА ОБЛАСТЬ/М.КИЇВ, БІЛА ЦЕРКВА, БІЛА ЦЕРКВА, 09113: Сквирське шосе 260А,(04563) 40024,cdzn_bolic@cim.uch.net,Куриленко Григорій Олексійович,директор,,,,
1595,Навчально-консультативний центр Харківської державної зооветеринарної академії на базі Василівського державного аграрного технікуму,,287,33774763,Державна,Міністерство освіти і науки України,Відокремлений підрозділ,ЗАПОРІЗЬКА ОБЛАСТЬ/М.ЗАПОРІЖЖЯ,ЗАПОРІЗЬКА ОБЛАСТЬ/М.ЗАПОРІЖЖЯ, ВАСИЛІВСЬКИЙ РАЙОН/М.ВАСИЛІВКА, ВАСИЛІВКА, 69000: 40 років Перемоги 10,,,Боєва Тетяна Сергіївна,,,,,
1596,Навчально-консультаційний центр Харківського національного університету радіоелектроніки у м. Кривому Розі,,92,33122726,Державна,Міністерство освіти і науки України,Відокремлений підрозділ,ДНІПРОПЕТРОВСЬКА ОБЛАСТЬ/М.ДНІПРОПЕТРОВСЬК,ДНІПРОПЕТРОВСЬКА ОБЛАСТЬ/М.ДНІПРОПЕТРОВСЬК, КРИВИЙ РІГ, ЦЕНТРАЛЬНО-МІСЬКИЙ, 50045: Туполєва 1,,,Роздоловський Михайло Юрійович,завідувач,,,,
1597,Закарпатське відділення Навчально-наукового інституту заочного та дистанційного навчання,,240,35295681,Державна,Міністерство внутрішніх справ України,Відокремлений підрозділ,ЗАКАРПАТСЬКА ОБЛАСТЬ/М.УЖГОРОД,ЗАКАРПАТСЬКА ОБЛАСТЬ/М.УЖГОРОД, МУКАЧЕВЕ, МУКАЧЕВЕ, 89000: Кооперативна 2,313137346,,Мотиль Віктор Іванович,Начальник,,,,
1600,"Відокремлений підрозділ ""Донецький факультет Київського національного університету культури і мистецтв`",Донецький факультет КНУК і М,308,26384340,Державна,Міністерство культури України,Відокремлений підрозділ,ЗАПОРІЗЬКА ОБЛАСТЬ/М.ЗАПОРІЖЖЯ,ЗАПОРІЗЬКА ОБЛАСТЬ/М.ЗАПОРІЖЖЯ, ЗАПОРІЖЖЯ, ЛЕНІНСЬКИЙ, 69096: Медична 8,(044) 529 98 31, (062) 30 56 231,ciselska@edbo.gov.ua,Костюченко Олена Вікторівна,декан,,,
1601,"Відокремлений підрозділ ""Запорізький факультет Київського національного університету культури і мистецтв""",Запорізький факультет КНУК і М,308,26520273,Державна,Міністерство культури України,Відокремлений підрозділ,ЗАПОРІЗЬКА ОБЛАСТЬ/М.ЗАПОРІЖЖЯ,ЗАПОРІЗЬКА ОБЛАСТЬ/М.ЗАПОРІЖЖЯ, ЗАПОРІЖЖЯ, ЛЕНІНСЬКИЙ, 69107: Медична 8,(044) 529 98 31, (062) 305 62 31, 061-22-48-577,,Злобін Юрій Вячеславович,декан,,
1602,"Відокремлений підрозділ ""Дніпропетровський факультет Київського національного університету культури і мистецтв""",Дніпропетровський факультет КНУК і М,308,26437332,Державна,Міністерство культури України,Відокремлений підрозділ,ДНІПРОПЕТРОВСЬКА ОБЛАСТЬ/М.ДНІПРОПЕТРОВСЬК,ДНІПРОПЕТРОВСЬКА ОБЛАСТЬ/М.ДНІПРОПЕТРОВСЬК, ДНІПРОПЕТРОВСЬК, ДНІПРОПЕТРОВСЬК, 49070: Карла Лібкнехта 9,056 744 47 62,ig.sivich@ukr.net,Мельник Ірина Юріївна,декан,,,,
