2,Донбаська національна академія будівництва і архітектури,ДОННАБА,0,2070795,Державна,Міністерство освіти і науки України,Академія,ДОНЕЦЬКА ОБЛАСТЬ/М.ДОНЕЦЬК,ДОНЕЦЬКА ОБЛАСТЬ/М.ДОНЕЦЬК, КРАМАТОРСЬК, КРАМАТОРСЬК, 84333: Лазо 14,+38 (0623) 22-24-67, (095) 388-69-63,akademiya.donnaba@gmail.com,Кравець Василь Анатолійович,Ректор,,,
3,Полтавський національний педагогічний університет імені В.Г. Короленка,ПНПУ,0,31035253,Державна,Міністерство освіти і науки України,Університет,ПОЛТАВСЬКА ОБЛАСТЬ/М.ПОЛТАВА,ПОЛТАВСЬКА ОБЛАСТЬ/М.ПОЛТАВА, ПОЛТАВА, ОКТЯБРСЬКИЙ, 36003: Остроградського 2,0532 225837,allmail@pnpu.edu.ua,Степаненко Микола Іванович,ректор,,,,
4,Донецький національний медичний університет ім. М. Горького,ДОННМУ ім. М. Горького,0,2010698,Державна,Міністерство охорони здоров`я України,Університет,ДОНЕЦЬКА ОБЛАСТЬ/М.ДОНЕЦЬК,ДОНЕЦЬКА ОБЛАСТЬ/М.ДОНЕЦЬК, КРАСНИЙ ЛИМАН, КРАСНИЙ ЛИМАН, 84404: Привокзальна 27,(062) 6416299,contact@dsmu.edu.ua,Думанський Юрій Васильович,ректор,,,,
5,"Приватний вищий навчальний заклад ""Українсько-американський гуманітарний інститут ""Вісконсинський Міжнародний Університет (США) в Україні""",ВМУУ,0,24265677,Приватна,Без підпорядкування,Інститут,М.КИЇВ,М.КИЇВ, ШЕВЧЕНКІВСЬКИЙ, ШЕВЧЕНКІВСЬКИЙ, 01030: Пирогова 9,(+38044)2160666,442361916,wiuu@wiuu.edu.ua,Романовський Олександр Олексійович,ректор,,,
6,Луганський державний університет внутрішніх справ імені Е.О. Дідоренка,ЛДУВС ім. Е.О. Дідоренка,0,8682387,Державна,Міністерство внутрішніх справ України,Університет,СУМСЬКА ОБЛАСТЬ/М.СУМИ,СУМСЬКА ОБЛАСТЬ/М.СУМИ, СУМИ, ЗАРІЧНИЙ, 40007: Миру 24,(0642)93-50-77, 55-32-00, 53-35-27, 96-99-84,lavd@mail.dsip.net,Комарницький Віталій Мар’янович,ректор,
7,Національний університет біоресурсів і природокористування України,НУБіП України,0,493706,Державна,Міністерство освіти і науки України,Університет,М.КИЇВ,М.КИЇВ, ГОЛОСІЇВСЬКИЙ, ГОЛОСІЇВСЬКИЙ, 03041: Героїв оборони 15,(044) 5278242,2613450,rectorat@nubip.edu.ua,Ніколаєнко Станіслав Миколайович,ректор,,,
9,Національний університет водного господарства та природокористування,НУВГП,0,2071116,Державна,Міністерство освіти і науки України,Університет,РІВНЕНСЬКА ОБЛАСТЬ/М.РІВНЕ,РІВНЕНСЬКА ОБЛАСТЬ/М.РІВНЕ, РІВНЕ, РІВНЕ, 33028: Соборна 11,(0362) 22-12-59,22-21-97,rc@nuwm.edu.ua,Мошинський Віктор Степанович,ректор,,,
10,"Республіканський вищий навчальний заклад ""Кримський гуманітарний університет"" (м. Ялта)",РВНЗ КГУ (м.Ялта),0,25150918,Комунальна,Міністерство освіти і науки, молоді та спорту Автономної Республіки Крим,Університет,АВТОНОМНА РЕСПУБЛІКА КРИМ/М.СІМФЕРОПОЛЬ,АВТОНОМНА РЕСПУБЛІКА КРИМ/М.СІМФЕРОПОЛЬ, ЯЛТА, ЯЛТА, 98635:  Севастопольська 2-а,(0654) 32-30-13,institutkgu@mail.ru,Глузман Олександр Володимирович,ректор,,,
11,"Євпаторійський інститут соціальних наук Республіканского вищого навчального закладу ""Кримський гуманітарний університет"" (м. Ялта)",ЄІСН,10,26135766,Комунальна,Міністерство освіти і науки, молоді та спорту Автономної Республіки Крим,Інститут,АВТОНОМНА РЕСПУБЛІКА КРИМ/М.СІМФЕРОПОЛЬ,АВТОНОМНА РЕСПУБЛІКА КРИМ/М.СІМФЕРОПОЛЬ, ЄВПАТОРІЯ, ЄВПАТОРІЯ, 97400:  Братів Просмушкіних 6,(06569) 3-02-48,е-mail.kguepf@mail.ru,Глузман Неля Анатоліївна,керівник,,,
13,"Державний заклад ""Луганський державний медичний університет""","ДЗ ""ЛДМУ""",0,2010675,Державна,Міністерство охорони здоров`я України,Університет,ЛУГАНСЬКА ОБЛАСТЬ/М.ЛУГАНСЬК,ЛУГАНСЬКА ОБЛАСТЬ/М.ЛУГАНСЬК, РУБІЖНЕ, РУБІЖНЕ, 93012: Будівельників 32,06453 6-17-32,canclsmu@ukr.net,Іоффе Ігор Володимирович,ректор,,,,
14,"Товариство з обмеженою відповідальністю ""Університет міжнародних інноваційних ідей""","ТОВ ""УМІІ""",0,13493914,Приватна,Без підпорядкування,Інститут,М.КИЇВ,М.КИЇВ, СОЛОМ'ЯНСЬКИЙ, СОЛОМ'ЯНСЬКИЙ, 03056: Ковальський 19, офіс 139 літера А,(044) 4530093; 4530094;,info@uii.org.ua,Грушко Елла Анатоліївна,в.о. ректора,,,
15,Донецький державний інститут здоров'я, фізичного виховання і спорту Національного університету фізичного виховання і спорту України,ДДІЗФВС НУФВСУ,180,38607071,Державна,Міністерство освіти і науки України,Інститут,ДОНЕЦЬКА ОБЛАСТЬ/М.ДОНЕЦЬК,М.КИЇВ, М.КИЇВ, М.КИЇВ, 83048: Байдукова 80,(062) 311-48-60,311 09 40,pk-dgizfvs@i.ua,Дубревський Юрій Михайлович,в.о. директора,,
16,Львівський торговельно-економічний університет,ЛТЕУ,0,1597980,Приватна,Укоопспілка,Університет,ЛЬВІВСЬКА ОБЛАСТЬ/М.ЛЬВІВ,ЛЬВІВСЬКА ОБЛАСТЬ/М.ЛЬВІВ, ЛЬВІВ, ЛИЧАКІВСЬКИЙ, 79005: Туган-Барановського 10,(032) 275-65-50, 275-68-66,lute@lute.lviv.ua,Куцик Петро Олексійович,ректор,,,
17,"Державний вищий навчальний заклад ""Донбаський державний педагогічний університет""",ДДПУ,0,38177113,Державна,Міністерство освіти і науки України,Університет,ДОНЕЦЬКА ОБЛАСТЬ/М.ДОНЕЦЬК,ДОНЕЦЬКА ОБЛАСТЬ/М.ДОНЕЦЬК, СЛОВ'ЯНСЬК, СЛОВ'ЯНСЬК, 84116: Генерала Батюка 19,+38(06262)3-23-54,sgpi@slav.dn.ua,Омельченко Світлана Олександрівна,ректор,,,,
18,Севастопольський національний технічний університет,СевНТУ,0,2070973,Державна,Міністерство освіти і науки України,Університет,М.СЕВАСТОПОЛЬ,М.СЕВАСТОПОЛЬ, М.СЕВАСТОПОЛЬ, М.СЕВАСТОПОЛЬ, 99053: Університетська 33,(0692) 243590,435002,root@sevgtu.sebastopol.ua,Пашков Євген Валентинович,Ректор,,,
19,Маріупольський державний університет,МДУ,0,26593428,Державна,Міністерство освіти і науки України,Університет,ДОНЕЦЬКА ОБЛАСТЬ/М.ДОНЕЦЬК,ДОНЕЦЬКА ОБЛАСТЬ/М.ДОНЕЦЬК, МАРІУПОЛЬ, МАРІУПОЛЬ, 87500: Будівельників  129-А,(0629) 53 22 70,53 22 52,53 22 64,53 22 51,info@mdu.in.ua,Балабанов Костянтин Васильович,ректор,
20,Вінницький національний медичний університет ім. М. І. Пирогова,ВНМУ,0,2010669,Державна,Міністерство охорони здоров`я України,Університет,ВІННИЦЬКА ОБЛАСТЬ/М.ВІННИЦЯ,ВІННИЦЬКА ОБЛАСТЬ/М.ВІННИЦЯ, ВІННИЦЯ, ЛЕНІНСЬКИЙ, 21018: Пирогова 56,(0432)570360,admission@vnmu.edu.ua,Мороз Василь Максимович,ректор,,,,
21,Східноукраїнський національний університет імені Володимира Даля,СНУ ім. В.Даля,0,2070714,Державна,Міністерство освіти і науки України,Університет,ЛУГАНСЬКА ОБЛАСТЬ/М.ЛУГАНСЬК,ЛУГАНСЬКА ОБЛАСТЬ/М.ЛУГАНСЬК, СЄВЄРОДОНЕЦЬК, СЄВЄРОДОНЕЦЬК, 93400: Центральний 59-А,(06452)40342,44097,uni.snu.edu@gmail.com,Поркуян Ольга Вікторівна,ректор,,,
22,"Кримський економічний інститут Державного вищого навчального закладу ""Київський національний економічний університет імені Вадима Гетьмана""","КЕІ ДВНЗ ""КНЕУ ім. В.Гетьмана""",337,24498826,Державна,Міністерство освіти і науки України,Інститут,АВТОНОМНА РЕСПУБЛІКА КРИМ/М.СІМФЕРОПОЛЬ,АВТОНОМНА РЕСПУБЛІКА КРИМ/М.СІМФЕРОПОЛЬ, СІМФЕРОПОЛЬ, СІМФЕРОПОЛЬ, 95015: Севастопольська 21/4,+38 (0652) 24-89-39,vstup@ceikneu.edu.ua,Реутов Віктор Євгенійович,директор,,,,
23,"Державна установа ""Кримський державний медичний університет імені С.І. Георгієвського""",ДУ КДМУ імені С. I. Георгiєвського,0,1896719,Державна,Міністерство охорони здоров`я України,Університет,АВТОНОМНА РЕСПУБЛІКА КРИМ/М.СІМФЕРОПОЛЬ,АВТОНОМНА РЕСПУБЛІКА КРИМ/М.СІМФЕРОПОЛЬ, СІМФЕРОПОЛЬ, СІМФЕРОПОЛЬ, 95006: Леніна 5/7,+38(0652) 554-804,office@csmu.strace.net,Бабанін Анатолій Андрійович,ректор,,,,
24,Національний транспортний університет,НТУ,0,2070915,Державна,Міністерство освіти і науки України,Університет,М.КИЇВ,М.КИЇВ, ПЕЧЕРСЬКИЙ, ПЕЧЕРСЬКИЙ, 01010: Суворова 1,+38(044) 280 82 03,general@ntu.edu.ua,Дмитриченко Микола Федорович,ректор,,,,
25,Київський університет права Національної академії наук України,КУП НАНУ,0,23745145,Державна,Національна академія наук України,Університет,М.КИЇВ,М.КИЇВ, ШЕВЧЕНКІВСЬКИЙ, ШЕВЧЕНКІВСЬКИЙ, 01001: Трьохсвятительська 4,(044) 4243335; 4522864,kul@kul.kiev.ua,Бошицький Юрій Ладиславович,ректор,,,,
26,"Приватний вищий навчальний заклад ""Мистецький інститут художнього моделювання та дизайну імені Сальвадора Далі""","ПВНЗ ""Мистецький інститут імені Сальвадора Далі""",0,32978839,Приватна,Без підпорядкування,Інститут,М.КИЇВ,М.КИЇВ, ДЕСНЯНСЬКИЙ, ДЕСНЯНСЬКИЙ, 02217: Братиславська 8,(044) 495-17-77; 390-37-96,mixmd@list.ru,Фурса Оксана Олександрівна,ректор,,,,
27,Полтавська державна аграрна академія,ПДАА,0,493014,Державна,Міністерство освіти і науки України,Академія,ПОЛТАВСЬКА ОБЛАСТЬ/М.ПОЛТАВА,ПОЛТАВСЬКА ОБЛАСТЬ/М.ПОЛТАВА, ПОЛТАВА, КИЇВСЬКИЙ, 36003: Г. Сковороди 1/3,(0532) 50-02-73, 22 28 39, 22 29 57,pdaa@pdaa.edu.ua,Аранчій Валентина Іванівна,ректор,,
28,Одеський національний університет імені І. І. Мечникова,ОНУ імені І.І. Мечникова,0,2071091,Державна,Міністерство освіти і науки України,Університет,ОДЕСЬКА ОБЛАСТЬ/М.ОДЕСА,ОДЕСЬКА ОБЛАСТЬ/М.ОДЕСА, ОДЕСА, ОДЕСА, 65026: Дворянська 2,+38(048) 723-52-54,233515,rektor@onu.edu.ua,Коваль Ігор Миколайович,ректор,,,
29,Харківський торговельно - економічний інститут Київського національного торговельно - економічного університету,ХТЕІ КНТЕУ,196,33297907,Державна,Міністерство освіти і науки України,Відокремлений підрозділ,ХАРКІВСЬКА ОБЛАСТЬ/М.ХАРКІВ,М.КИЇВ, М.КИЇВ, М.КИЇВ, 61045: Отакара Яроша 8,+38 (057) 340-33-34,htei.knteu@gmail.com,Гурова Капіталіна Дмитрівна,директор,,,,
30,Національний університет державної податкової служби України,Національний університет ДПС України,3457,2973089,Державна,Міністерство освіти і науки України,Університет,КИЇВСЬКА ОБЛАСТЬ/М.КИЇВ,КИЇВСЬКА ОБЛАСТЬ/М.КИЇВ, ІРПІНЬ, ІРПІНЬ, 08200: Карла Маркса 31,(04597) 56595,60705,57571,nudpsu@nusta.edu.ua,Тарангул Людмила Леонідівна,голова комісії з реорганзації,,
31,Одеський національний економічний університет,ОНЕУ,0,2071079,Державна,Міністерство освіти і науки України,Університет,ОДЕСЬКА ОБЛАСТЬ/М.ОДЕСА,ОДЕСЬКА ОБЛАСТЬ/М.ОДЕСА, ОДЕСА, ПРИМОРСЬКИЙ, 65082: Преображенська 8,(048)723-61-58,mail@oneu.edu.ua,Звєряков Михайло Іванович,ректор,,,,
32,Приватний вищий навчальний заклад «Хмельницький економічний університет»,"Приватний вищий навчальний заклад ""Хмельницький економічний університет""",0,14153730,Приватна,Без підпорядкування,Університет,ХМЕЛЬНИЦЬКА ОБЛАСТЬ/М.ХМЕЛЬНИЦЬКИЙ,ХМЕЛЬНИЦЬКА ОБЛАСТЬ/М.ХМЕЛЬНИЦЬКИЙ, ХМЕЛЬНИЦЬКИЙ, ХМЕЛЬНИЦЬКИЙ, 29008: Кам’янецька 159/2,(0382) 72-89-25, (0382) 67-01-43,kheu@hm.ukrtel.net,Смоленюк Руслан Петрович,ректор,,,
33,Сумський державний педагогічний університет ім. А.С. Макаренка,СДПУ ім. А.С. Макаренка,0,2125510,Державна,Міністерство освіти і науки України,Університет,СУМСЬКА ОБЛАСТЬ/М.СУМИ,СУМСЬКА ОБЛАСТЬ/М.СУМИ, СУМИ, КОВПАКІВСЬКИЙ, 40002: Роменська 87,(0542) 22-14-95, 22-15-17,rector@sspu.sumy.ua,Лянной Юрій Олегович,ректор,,,
34,"Національний аерокосмічний університет ім. М. Є. Жуковського ""Харківський авіаційний інститут""",ХАІ,0,2066769,Державна,Міністерство освіти і науки України,Університет,ХАРКІВСЬКА ОБЛАСТЬ/М.ХАРКІВ,ХАРКІВСЬКА ОБЛАСТЬ/М.ХАРКІВ, ХАРКІВ, КИЇВСЬКИЙ, 61070: Чкалова 17,(057) 315-10-56,7884040,7074000,7074080,khai@khai.edu,Кривцов Володимир Станіславович,ректор,
35,Керченський державний морський технологічний університет,КДМТУ,0,34571906,Державна,Міністерство аграрної політики та продовольства України,Університет,АВТОНОМНА РЕСПУБЛІКА КРИМ/М.СІМФЕРОПОЛЬ,АВТОНОМНА РЕСПУБЛІКА КРИМ/М.СІМФЕРОПОЛЬ, КЕРЧ, КЕРЧ, 98309: Орджонікідзе 82,+38 (06561) 6-35-85,kmti@aironet.com.ua, pk_kgmtu@mail.ru,Масюткін Євген Петрович,ректор,,,
36,"Державний вищий навчальний заклад ""Національний гірничий університет""","Державний ВНЗ ""НГУ""",0,2070743,Державна,Міністерство освіти і науки України,Університет,ДНІПРОПЕТРОВСЬКА ОБЛАСТЬ/М.ДНІПРОПЕТРОВСЬК,ДНІПРОПЕТРОВСЬКА ОБЛАСТЬ/М.ДНІПРОПЕТРОВСЬК, ДНІПРОПЕТРОВСЬК, ДНІПРОПЕТРОВСЬК, 49000: Карла Маркса 19,+38 (056) 744-62-19,nmu@nmu.org.ua,Півняк Геннадій Григорович,ректор,,,,
37,Запорізька державна інженерна академія,ЗДІА,0,5402565,Державна,Міністерство освіти і науки України,Академія,ЗАПОРІЗЬКА ОБЛАСТЬ/М.ЗАПОРІЖЖЯ,ЗАПОРІЗЬКА ОБЛАСТЬ/М.ЗАПОРІЖЖЯ, ЗАПОРІЖЖЯ, ЛЕНІНСЬКИЙ, 69006: Леніна  226,(061) 283-08-38,admin@zgia.zp.ua,Банах Віктор Аркадійович,ректор,,,,
38,Інститут хімічних технологій Східноукраїнського національного університету імені Володимира Даля (м. Рубіжне),ІХТ СНУ ім. В. Даля (м. Рубіжне),21,5465028,Державна,Міністерство освіти і науки України,Відокремлений підрозділ,ЛУГАНСЬКА ОБЛАСТЬ/М.ЛУГАНСЬК,ЛУГАНСЬКА ОБЛАСТЬ/М.ЛУГАНСЬК, РУБІЖНЕ, РУБІЖНЕ, 93009: Леніна 31,+38 (06453) 6-40-49,сontact@iht.lg.ua,Тімошин Анатолій Сергійович,в.о. директора,,,,
39,Український державний університет залізничного транспорту,УкрДУЗТ,0,1116472,Державна,Міністерство освіти і науки України,Університет,ХАРКІВСЬКА ОБЛАСТЬ/М.ХАРКІВ,ХАРКІВСЬКА ОБЛАСТЬ/М.ХАРКІВ, ХАРКІВ, МОСКОВСЬКИЙ, 61050: Фейєрбаха 7,(057) 7301013; 322067; 206007; 322882,info@kart.edu.ua,Панченко Сергій Володимирович,ректор,,,,
40,Рівненський державний гуманітарний університет,РДГУ,0,25736989,Державна,Міністерство освіти і науки України,Університет,РІВНЕНСЬКА ОБЛАСТЬ/М.РІВНЕ,РІВНЕНСЬКА ОБЛАСТЬ/М.РІВНЕ, РІВНЕ, РІВНЕ, 33028: Степана Бандери 12,(0362) 26 78 65, 26 37 15,rektorat@rdgu.uar.net,Постоловський Руслан Михайлович,ректор,,,
41,Київський національний університет імені Тараса Шевченка,КНУТШ,0,2070944,Державна,Міністерство освіти і науки України,Університет,М.КИЇВ,М.КИЇВ, ШЕВЧЕНКІВСЬКИЙ, ШЕВЧЕНКІВСЬКИЙ, 01601: Володимирська 60,(044) 239-32-20, 289-86-91, 234-89-04,stationery@univ.kiev.ua, office.chief@univ.net.ua,Губерський Леонід Васильович,ректор,
42,"Державний вищий навчальний заклад ""Приазовський державний технічний університет""","ДВНЗ ""ПДТУ""",0,2070812,Державна,Міністерство освіти і науки України,Університет,ДОНЕЦЬКА ОБЛАСТЬ/М.ДОНЕЦЬК,ДОНЕЦЬКА ОБЛАСТЬ/М.ДОНЕЦЬК, МАРІУПОЛЬ, МАРІУПОЛЬ, 87500: Університетська 7,(0629) 33-34-16, (0629)33-21-08,office@pstu.edu,Волошин В`ячеслав Степанович,ректор,,,
43,"Державний вищий навчальний заклад ""Придніпровська державна академія будівництва та архітектури""",ДВНЗ ПДАБА,0,2070772,Державна,Міністерство освіти і науки України,Академія,ДНІПРОПЕТРОВСЬКА ОБЛАСТЬ/М.ДНІПРОПЕТРОВСЬК,ДНІПРОПЕТРОВСЬКА ОБЛАСТЬ/М.ДНІПРОПЕТРОВСЬК, ДНІПРОПЕТРОВСЬК, ДНІПРОПЕТРОВСЬК, 49600: Чернишевського 24-а,(056) 745 23 72,prkom@mail.pgasa.dp.ua,Большаков Володимир Іванович,ректор,,,,
44,Східноєвропейський національний університет імені Лесі Українки,СНУ ім. Лесі Українки,0,2125102,Державна,Міністерство освіти і науки України,Університет,ВОЛИНСЬКА ОБЛАСТЬ/М.ЛУЦЬК,ВОЛИНСЬКА ОБЛАСТЬ/М.ЛУЦЬК, ЛУЦЬК, ЛУЦЬК, 43025: Волі 13,0-(332) 24-00-18,post@univer.lutsk.ua,Коцан Ігор Ярославович,ректор,,,,
45,"Відокремлений підрозділ ""Ровеньківський факультет Луганського національного університету імені Тараса Шевченка""","ВП ""Ровеньківський факультет ЛНУ імені Тараса Шевченка """,81,26298008,Державна,Міністерство освіти і науки України,Відокремлений підрозділ,ЛУГАНСЬКА ОБЛАСТЬ/М.ЛУГАНСЬК,ЛУГАНСЬКА ОБЛАСТЬ/М.ЛУГАНСЬК, СТАРОБІЛЬСЬКИЙ РАЙОН/М.СТАРОБІЛЬСЬК, СТАРОБІЛЬСЬК, 92700: Гоголя 1,(06433)5-39-82, (06433)5-39-88-факс,rovfaculty@mail.ru,Мороз Володимир Петрович,в.о. декана,,,
46,Севастопольський міський гуманітарний університет,СМГУ,0,26264765,Комунальна,Управління освіти і науки Севастопольської державної адміністрації,Університет,М.СЕВАСТОПОЛЬ,М.СЕВАСТОПОЛЬ, М.СЕВАСТОПОЛЬ, М.СЕВАСТОПОЛЬ, 99011: Набарежна Корнілова 1,(0692) 543633,550520,rector@smuh.edu.ua,Лапенок Марія Іванівна,ректор,,,
47,Національний університет харчових технологій,НУХТ,0,2070938,Державна,Міністерство освіти і науки України,Університет,М.КИЇВ,М.КИЇВ, ГОЛОСІЇВСЬКИЙ, ГОЛОСІЇВСЬКИЙ, 01033: Володимирська 68,+30(044) 289-95-55,info@nuft.edu.ua,Українець Анатолій Іванович,ректор,,,,
48,Херсонський державний університет,ХДУ,0,2125609,Державна,Міністерство освіти і науки України,Університет,ХЕРСОНСЬКА ОБЛАСТЬ/М.ХЕРСОН,ХЕРСОНСЬКА ОБЛАСТЬ/М.ХЕРСОН, ХЕРСОН, ДНІПРОВСЬКИЙ, 73000: 40 років Жовтня 27,(0552)32-67-05,office@ksu.ks.ua,Стратонов Василь Миколайович,ректор,,,,
