477,Дніпропетровський коледж ракетно - космічного машинобудування Дніпропетровського національного університету імені Олеся Гончара,,111,21909950,Державна,Міністерство освіти і науки України,Відокремлений підрозділ,ДНІПРОПЕТРОВСЬКА ОБЛАСТЬ/М.ДНІПРОПЕТРОВСЬК,ДНІПРОПЕТРОВСЬКА ОБЛАСТЬ/М.ДНІПРОПЕТРОВСЬК, ДНІПРОПЕТРОВСЬК, ДНІПРОПЕТРОВСЬК, 49089: Макарова 27,567923622,trkm.dnu@gmail.com,Романовський Олександр Михайлович,директор,,,,
478,Дніпропетровський монтажний технікум,ДМТ,0,4760713,Державна,Міністерство освіти і науки України,Технікум (училище),ДНІПРОПЕТРОВСЬКА ОБЛАСТЬ/М.ДНІПРОПЕТРОВСЬК,ДНІПРОПЕТРОВСЬКА ОБЛАСТЬ/М.ДНІПРОПЕТРОВСЬК, ДНІПРОПЕТРОВСЬК, ДНІПРОПЕТРОВСЬК, 49600: Столярова 8,(056) 744 28 59,dnmont@gmail.com,Ватагіна Вероніка Василівна,директор,,,,
479,Дніпропетровський педагогічний коледж Дніпропетровського національного університету імені Олеся Гончара,ДПК ДНУ,111,2128661,Державна,Департамент освіти і науки Дніпропетровської обласної державної адміністрації,Відокремлений підрозділ,ДНІПРОПЕТРОВСЬКА ОБЛАСТЬ/М.ДНІПРОПЕТРОВСЬК,ДНІПРОПЕТРОВСЬКА ОБЛАСТЬ/М.ДНІПРОПЕТРОВСЬК, ДНІПРОПЕТРОВСЬК, ДНІПРОПЕТРОВСЬК, 49054: Гагаріна 72,(056)377-40-26,PUDNU@I.UA,Василега Ірина Даниїлівна,директор,,,,
480,Дніпропетровський радіоприладобудівний коледж,ДРПБК,0,21910232,Державна,Міністерство освіти і науки України,Коледж,ДНІПРОПЕТРОВСЬКА ОБЛАСТЬ/М.ДНІПРОПЕТРОВСЬК,ДНІПРОПЕТРОВСЬКА ОБЛАСТЬ/М.ДНІПРОПЕТРОВСЬК, ДНІПРОПЕТРОВСЬК, КРАСНОГВАРДІЙСЬКИЙ, 49000: Шмідта 18,0567264208; 7708181; 2425903;2420155; 2396541,,Тіхонов Василь Андрійович,директор,,,,
481,"Державний вищий навчальний заклад ""Дніпропетровський коледж транспортної інфраструктури""","ДВНЗ ""ДТЗТ""",0,1116118,Державна,Міністерство освіти і науки України,Коледж,ДНІПРОПЕТРОВСЬКА ОБЛАСТЬ/М.ДНІПРОПЕТРОВСЬК,ДНІПРОПЕТРОВСЬКА ОБЛАСТЬ/М.ДНІПРОПЕТРОВСЬК, ДНІПРОПЕТРОВСЬК, ДНІПРОПЕТРОВСЬК, 49006: Пушкіна 77-а,567932699,dtgt@a-teleport.com,Павленко Ігор Петрович,директор,,,,
482,Дніпропетровський технікум зварювання та електроніки імені Є.О. Патона,ДТЗЕ,0,129314,Державна,Міністерство освіти і науки України,Технікум (училище),ДНІПРОПЕТРОВСЬКА ОБЛАСТЬ/М.ДНІПРОПЕТРОВСЬК,ДНІПРОПЕТРОВСЬКА ОБЛАСТЬ/М.ДНІПРОПЕТРОВСЬК, ДНІПРОПЕТРОВСЬК, ДНІПРОПЕТРОВСЬК, 49044: Клари Цеткін 2А,(0562)46 31 21,(0562)47 74 12,(0562)47 74 12,dtsepaton@gmail.com,Левчук Леонід Олександрович,директор,,
483,Донецьке вище училище олімпійського резерву ім. С. Бубки,ДВУОР ім. С. Бубки,0,20361881,Комунальна,Департамент освіти і науки Донецької обласної державної адміністрації,Технікум (училище),ДОНЕЦЬКА ОБЛАСТЬ/М.ДОНЕЦЬК,ДОНЕЦЬКА ОБЛАСТЬ/М.ДОНЕЦЬК, АРТЕМІВСЬК, АРТЕМІВСЬК, 84500: Благовіщенська 43,(095) 104 88 97,dvuor.s.bubki@gmail.com,Анушкевич Ігор Казимирович,директор,,,,
484,Донецьке музичне училище,ДМУ,0,2214544,Комунальна,Міністерство культури України,Технікум (училище),ДОНЕЦЬКА ОБЛАСТЬ/М.ДОНЕЦЬК,ДОНЕЦЬКА ОБЛАСТЬ/М.ДОНЕЦЬК, ДОНЕЦЬК, ДОНЕЦЬК, 83050: Рози Люксембург 23,623054754,donmu@km.ru,Куслін Олександр Васильович,В.о. директора,,,,
485,Донецьке училище культури,,0,2214550,Комунальна,Управління (головне управління) культури обласної державної адміністрації,Технікум (училище),ДОНЕЦЬКА ОБЛАСТЬ/М.ДОНЕЦЬК,ДОНЕЦЬКА ОБЛАСТЬ/М.ДОНЕЦЬК, ДОНЕЦЬК, ДОНЕЦЬК, 83096: Куйбишева 128 ,+38(062)311-63-89, +38(062)253-16-33, +38(062)253-17-88,duk-kultura@rambler.ru,Волошко Наталя Валентинівна,директор,,
486,Донецьке художнє училище,,0,2215489,Комунальна,Департамент освіти і науки Донецької обласної державної адміністрації,Технікум (училище),ДОНЕЦЬКА ОБЛАСТЬ/М.ДОНЕЦЬК,ДОНЕЦЬКА ОБЛАСТЬ/М.ДОНЕЦЬК, ДОНЕЦЬК, ДОНЕЦЬК, 83062: Ткаченка 92,(062)2667088,des_college@ukr.net,Молодчинний Юрий Васильович,директор,,,,
487,Донецький базовий медичний коледж,ДБМК,0,2011172,Комунальна,Міністерство охорони здоров`я України,Коледж,ДОНЕЦЬКА ОБЛАСТЬ/М.ДОНЕЦЬК,ДОНЕЦЬКА ОБЛАСТЬ/М.ДОНЕЦЬК, ДОНЕЦЬК, КАЛІНІНСЬКИЙ, 83017: Шевченка 34,+38(062)385-81-04,dbmс@ukr.net,Швидкий Олег Вікторович,директор,,,,
488,Донецький гірничий технікум ім. Є.Т. Абакумова,ДГТ ім. Є.Т. Абакумова,0,173456,Державна,Міністерство освіти і науки України,Технікум (училище),ДОНЕЦЬКА ОБЛАСТЬ/М.ДОНЕЦЬК,ДОНЕЦЬКА ОБЛАСТЬ/М.ДОНЕЦЬК, ДОНЕЦЬК, ДОНЕЦЬК, 83037: Петровського 4,277-13-14,dgt.dc.dn@mail.ru,Русаков Олег Миколайович,директор,,,,
489,Донецький гірничо-економічний технікум,ДГЕТ,0,173373,Державна,Міністерство освіти і науки України,Технікум (училище),ДОНЕЦЬКА ОБЛАСТЬ/М.ДОНЕЦЬК,ДОНЕЦЬКА ОБЛАСТЬ/М.ДОНЕЦЬК, ДОНЕЦЬК, ВОРОШИЛОВСЬКИЙ, 83086: Артема 17/19,623853692,dget@ukr.net,Морозов Василь Дмитрович,директор,,,,
490,Донецький державний технікум економіки і хімічних технологій,ДДТЕХТ,0,208769,Державна,Міністерство освіти і науки України,Технікум (училище),ДОНЕЦЬКА ОБЛАСТЬ/М.ДОНЕЦЬК,ДОНЕЦЬКА ОБЛАСТЬ/М.ДОНЕЦЬК, ДОНЕЦЬК, ДОНЕЦЬК, 83114: Щорса 97,(062)305-65-87,dgteht@ukr.net,Екбер Михайло Борисович, директор,,,,
491,Донецький електрометалургійний технікум,ДЕМТ,0,193571,Державна,Міністерство освіти і науки України,Технікум (училище),ДОНЕЦЬКА ОБЛАСТЬ/М.ДОНЕЦЬК,ДОНЕЦЬКА ОБЛАСТЬ/М.ДОНЕЦЬК, ДОНЕЦЬК, ДОНЕЦЬК, 83062: І. Ткаченка 104,(062)266-50-63,demt_@ukr.net,Караван Ігор Анатолійович,директор,,,,
492,"Державний вищий навчальний заклад ""Донецький транспортно-економічний коледж""","ДВНЗ ""ДТЕК""",0,173396,Державна,Міністерство освіти і науки України,Коледж,ДОНЕЦЬКА ОБЛАСТЬ/М.ДОНЕЦЬК,ДОНЕЦЬКА ОБЛАСТЬ/М.ДОНЕЦЬК, ДОНЕЦЬК, ВОРОШИЛОВСЬКИЙ, 83086: Артема 17,+38(062)304-23-81,dit@ukrpost.net,Демура Юрій Миколайович,директор,,,,
493,Донецький індустріально-педагогічний технікум,ДІПТ,0,2500729,Державна,Міністерство освіти і науки України,Технікум (училище),ДОНЕЦЬКА ОБЛАСТЬ/М.ДОНЕЦЬК,ДОНЕЦЬКА ОБЛАСТЬ/М.ДОНЕЦЬК, ДОНЕЦЬК, КІРОВСЬКИЙ, 83117: Текстильників 5,(062) 334-44-60,centralmk@i.ua,Джантіміров Анатолій Юрійович,директор,,,,
494,Донецький інженерно-економічний коледж (у формі товариства з обмеженою відповідальністю),ДонІЕК,0,21962766,Приватна,Без підпорядкування,Коледж,ДОНЕЦЬКА ОБЛАСТЬ/М.ДОНЕЦЬК,ДОНЕЦЬКА ОБЛАСТЬ/М.ДОНЕЦЬК, ДОНЕЦЬК, ДОНЕЦЬК, 83001: Артема 58,(62) 301-07-90,doniek@dgtu.donetsk.ua,Каплюхін Олександр Якимович,ректор,,,,
495,Донецький коледж технологій та дизайну Донецького національного університету економіки і торгівлі імені Михайла Туган-Барановського,ДКТД ДонНУЕТ,135,37719968,Державна,Міністерство освіти і науки України,Коледж,ДОНЕЦЬКА ОБЛАСТЬ/М.ДОНЕЦЬК,ДОНЕЦЬКА ОБЛАСТЬ/М.ДОНЕЦЬК, ДОНЕЦЬК, ДОНЕЦЬК, 83050: Щорса 31,(062) 306-37-78,dgttd@dc.ukrtel.net,Дороніна Ірина Омелянівна,директор,,,,
496,Донецький політехнічний технікум,ДПТ,0,193542,Державна,Міністерство освіти і науки України,Технікум (училище),ДОНЕЦЬКА ОБЛАСТЬ/М.ДОНЕЦЬК,ДОНЕЦЬКА ОБЛАСТЬ/М.ДОНЕЦЬК, ДОНЕЦЬК, ВОРОШИЛОВСЬКИЙ, 83001: Челюскінців 159,+38(062)338-11-53,polytechik@matrixhome.net,Голос Ілля Григорович,директор,,,,
497,"Державний вищий навчальний заклад ""Дрогобицький коледж нафти і газу""",ДКНГ,0,146896,Державна,Міністерство освіти і науки України,Коледж,ЛЬВІВСЬКА ОБЛАСТЬ/М.ЛЬВІВ,ЛЬВІВСЬКА ОБЛАСТЬ/М.ЛЬВІВ, ДРОГОБИЧ, ДРОГОБИЧ, 82100: Грушевського 57,(0324) 3-89-69,dkng@ukr.net,Баб'як Мирон Михайлович,директор,,,,
498,Дружківський технікум Донбаської державної машинобудівної академії,ДТ ДДМА,52,173367,Державна,Міністерство освіти і науки України,Технікум (училище),ДОНЕЦЬКА ОБЛАСТЬ/М.ДОНЕЦЬК,ДОНЕЦЬКА ОБЛАСТЬ/М.ДОНЕЦЬК, ДРУЖКІВКА, ДРУЖКІВКА, 84200: Леніна 32,(06267) 43132,dtddma@rambler.ru,Баштовий Віктор Павлович,директор,,,,
499,Дубенський коледж культури і мистецтв Рівненського державного гуманітарного університету,Дубенський коледж культури і мистецтв РДГУ,40,25894748,Державна,Міністерство освіти і науки України,Відокремлений підрозділ,РІВНЕНСЬКА ОБЛАСТЬ/М.РІВНЕ,РІВНЕНСЬКА ОБЛАСТЬ/М.РІВНЕ, ДУБНО, ДУБНО, 35600: Замкова 6,(03656) 4 17 43,kulturedubno@gmail.com,Гавриленко Володимир Миколайович,директор,,,,
500,Екологічний коледж Львівського національного аграрного університету,ЕК ЛНАУ,162,34387378,Державна,Міністерство освіти і науки України,Відокремлений підрозділ,ЛЬВІВСЬКА ОБЛАСТЬ/М.ЛЬВІВ,ЛЬВІВСЬКА ОБЛАСТЬ/М.ЛЬВІВ, ЛЬВІВ, ШЕВЧЕНКІВСЬКИЙ, 79068: Замарстинівська 167,(032) 242-26-41, (032) 242-26-42,ek.lviv.nau@gmail.com,Панюра Ярослав Йосипович,директор,,,
501,"Економічний коледж Державного вищого навчального закладу ""Київський національний економічний університет імені Вадима Гетьмана""","ЕКДВНЗ ""КНЕУ ім. В. Гетьмана""",337,4618613,Державна,Міністерство освіти і науки України,Відокремлений підрозділ,М.КИЇВ,М.КИЇВ, СВЯТОШИНСЬКИЙ, СВЯТОШИНСЬКИЙ, 03148: Василя Верховинця 3,403-04-47,ekkneu@inbox.ru,Марушевська Валентина Іларіонівна,директор,,,,
502,Ерастівський коледж ім. Е.К. Бродського Дніпропетровського державного аграрно-економічного університету,ЕКБДДАЕУ,80,26371952,Державна,Міністерство освіти і науки України,Коледж,ДНІПРОПЕТРОВСЬКА ОБЛАСТЬ/М.ДНІПРОПЕТРОВСЬК,ДНІПРОПЕТРОВСЬКА ОБЛАСТЬ/М.ДНІПРОПЕТРОВСЬК, П'ЯТИХАТСЬКИЙ РАЙОН/М.П'ЯТИХАТКИ, ВИШНЕВЕ, 52150: Мічуріна 6,565160809,Erastovsky@ukr.net,Соколик Наталія Іванівна,директор,,,,
503,Єнакієвський металургійний технікум,ЄМТ,0,193536,Державна,Міністерство освіти і науки України,Технікум (училище),ДОНЕЦЬКА ОБЛАСТЬ/М.ДОНЕЦЬК,ДОНЕЦЬКА ОБЛАСТЬ/М.ДОНЕЦЬК, ЄНАКІЄВЕ, ЄНАКІЄВЕ, 86424: 50 років Жовтня 40,+38(062)522-29-79, +38(062)522-32-78,grishanof@ghost.dn.ua,Подольский Микола Васильович,директор,,,
504,Єнакієвський політехнічний технікум,ЄПТ,0,173433,Державна,Міністерство освіти і науки України,Технікум (училище),ДОНЕЦЬКА ОБЛАСТЬ/М.ДОНЕЦЬК,ДОНЕЦЬКА ОБЛАСТЬ/М.ДОНЕЦЬК, ЄНАКІЄВЕ, ЄНАКІЄВЕ, 86401: ХХ партз'їзду 18,(06252) 3-01-69,politeh@wn.dn.ua,Іонченков Сергій Олександрович,директор,,,,
506,Житлово-комунальний коледж Харківського національного університету міського господарства імені О.М. Бекетова,,316,3363134,Державна,Міністерство освіти і науки України,Коледж,ХАРКІВСЬКА ОБЛАСТЬ/М.ХАРКІВ,ХАРКІВСЬКА ОБЛАСТЬ/М.ХАРКІВ, ХАРКІВ, КИЇВСЬКИЙ, 61002: Революції  12,(057)7041097,jkt45@ukr.net,Лук`янов Віктор Іванович,директор,,,,
507,Житомирське музичне училище ім. В.С. Косенка Житомирської обласної ради,ЖМУ,0,2215012,Комунальна,Обласна рада,Технікум (училище),ЖИТОМИРСЬКА ОБЛАСТЬ/М.ЖИТОМИР,ЖИТОМИРСЬКА ОБЛАСТЬ/М.ЖИТОМИР, ЖИТОМИР, КОРОЛЬОВСЬКИЙ, 10014: Пушкінська 28,0412 37 34 29, 37 28 37,zhmukos@meta.ua,Шестаков Євгеній Станіславович,директор,,,
508,Житомирський коледж культури і мистецтв ім. Івана Огієнка Житомирської обласної ради,ЖККіМ ім. Івана Огієнка,0,2214596,Комунальна,Обласна рада,Коледж,ЖИТОМИРСЬКА ОБЛАСТЬ/М.ЖИТОМИР,ЖИТОМИРСЬКА ОБЛАСТЬ/М.ЖИТОМИР, ЖИТОМИР, КОРОЛЬОВСЬКИЙ, 10008: Івана Франка 16,0412 37 22 73, 34 44 78,muzauk@rambler.ru,Покропивний Микола Петрович,директор,,,
509,Житомирський автомобільно-дорожній коледж Національного транспортного університету,ЖАДК НТУ,24,38650457,Державна,Міністерство освіти і науки України,Відокремлений підрозділ,ЖИТОМИРСЬКА ОБЛАСТЬ/М.ЖИТОМИР,ЖИТОМИРСЬКА ОБЛАСТЬ/М.ЖИТОМИР, ЖИТОМИР, КОРОЛЬОВСЬКИЙ, 10001: Велика Бердичівська 2,412471810,zadk@zt.ukrtel.net,Ніколенко Олександр Васильович,директор,,,,
510,Житомирський агротехнічний коледж,ЖАТК,0,727966,Державна,Міністерство освіти і науки України,Коледж,ЖИТОМИРСЬКА ОБЛАСТЬ/М.ЖИТОМИР,ЖИТОМИРСЬКА ОБЛАСТЬ/М.ЖИТОМИР, ЖИТОМИР, БОГУНСЬКИЙ, 10031: Щорса 96,(412) 25 31 06, 25 95 38,info@zhatk.zt.ua,Тимошенко Микола Михайлович,директор,,,
511,"Комунальний вищий навчальний заклад ""Житомирський базовий фармацевтичний коледж ім. Г.С. Протасевича"" Житомирської обласної ради",КВНЗ ЖБФК,0,2011261,Комунальна,Обласна рада,Коледж,ЖИТОМИРСЬКА ОБЛАСТЬ/М.ЖИТОМИР,ЖИТОМИРСЬКА ОБЛАСТЬ/М.ЖИТОМИР, ЖИТОМИР, БОГУНСЬКИЙ, 10005: Черняховського 99,+38(041)224-25-45, +38(041)224-25-50,pharm@ukrpost.ua,Хомік Євгеній Володимирович,директор,,,
512,Житомирський кооперативний коледж бізнесу і права,ЖККБП,0,1788183,Приватна,Без підпорядкування,Коледж,ЖИТОМИРСЬКА ОБЛАСТЬ/М.ЖИТОМИР,ЖИТОМИРСЬКА ОБЛАСТЬ/М.ЖИТОМИР, ЖИТОМИР, КОРОЛЬОВСЬКИЙ, 10012: Київська 82,(0412) 37-47-63,zhitocol@ukr.net,Кравчук Василь Петрович,директор,,,,
514,Жовтоводський промисловий коледж Дніпропетровського національного університету імені Олеся Гончара,ЖВПК ДНУ,111,21903083,Державна,Міністерство освіти і науки України,Коледж,ДНІПРОПЕТРОВСЬКА ОБЛАСТЬ/М.ДНІПРОПЕТРОВСЬК,ДНІПРОПЕТРОВСЬКА ОБЛАСТЬ/М.ДНІПРОПЕТРОВСЬК, ЖОВТІ ВОДИ, ЖОВТІ ВОДИ, 52204: Петровського 35,565227417,gvpt@ua.fm,Кочерга Віталій Григорович,директор,,,,
515,Закарпатський базовий державний медичний коледж,ЗБДМК,0,2010706,Державна,Управління (головне управління) охорони здоров`я обласної державної адміністрації,Коледж,ЗАКАРПАТСЬКА ОБЛАСТЬ/М.УЖГОРОД,ЗАКАРПАТСЬКА ОБЛАСТЬ/М.УЖГОРОД, ХУСТ, ХУСТ, 90400: Львівська 143,+38(031)424-23-87,zdbmk143@ukr.net,Яким Ярослав Степанович,директор,,,,
516,"Закарпатський лісотехнічний коледж Державного вищого навчального закладу ""Національний лісотехнічний університет України""",ЗЛТК,160,275932,Державна,Міністерство освіти і науки України,Відокремлений підрозділ,ЗАКАРПАТСЬКА ОБЛАСТЬ/М.УЖГОРОД,ЗАКАРПАТСЬКА ОБЛАСТЬ/М.УЖГОРОД, ХУСТ, ХУСТ, 90400: Августина Волошина 66,(03142)4-35-07,zltk@ukr.net,Ковалишин Роман Володимирович,директор,,,,
517,Закарпатський машинобудівний технікум,ЗМТ,0,22111094,Державна,Міністерство освіти і науки України,Технікум (училище),ЗАКАРПАТСЬКА ОБЛАСТЬ/М.УЖГОРОД,ЗАКАРПАТСЬКА ОБЛАСТЬ/М.УЖГОРОД, ТЯЧІВСЬКИЙ РАЙОН/М.ТЯЧІВ, ДУБОВЕ, 90531: Гагаріна 1,+38(031)347-24-82,dolgin@tyachiv.com,Горобець Вячеслав Вікторович,директор,,,,
518,Запорізький авіаційний коледж ім. О.Г. Івченка,ЗАК,0,20507735,Державна,Міністерство освіти і науки України,Коледж,ЗАПОРІЗЬКА ОБЛАСТЬ/М.ЗАПОРІЖЖЯ,ЗАПОРІЗЬКА ОБЛАСТЬ/М.ЗАПОРІЖЖЯ, ЗАПОРІЖЖЯ, ШЕВЧЕНКІВСЬКИЙ, 69068: Іванова 97-Б,+38(061)265-33-33,zac.office@meta.ua,Дудников Олександр Сергійович,директор,,,,
519,Запорізький гідроенергетичний коледж  Запорізької державної інженерної академії,ЗГЕК ЗДІА,37,129366,Державна,Міністерство освіти і науки України,Відокремлений підрозділ,ЗАПОРІЗЬКА ОБЛАСТЬ/М.ЗАПОРІЖЖЯ,ЗАПОРІЗЬКА ОБЛАСТЬ/М.ЗАПОРІЖЖЯ, ЗАПОРІЖЖЯ, ЛЕНІНСЬКИЙ, 69015: Мінська 10,(061)-224-87-47,zgec.zdia@gmail.com,Черненко Віктор Вячеславович,директор,,,,
520,Запорізький гуманітарний коледж Запорізького національного технічного університету,ЗГК ЗНТУ,91,37255750,Державна,Міністерство освіти і науки України,Коледж,ЗАПОРІЗЬКА ОБЛАСТЬ/М.ЗАПОРІЖЖЯ,ЗАПОРІЗЬКА ОБЛАСТЬ/М.ЗАПОРІЖЖЯ, ЗАПОРІЖЖЯ, ОРДЖОНІКІДЗЕВСЬКИЙ, 69057: Яценка 3 А ,612246646,zgk_zntu@ukr.net,Приходько Євгенія Теодорівна,директор,,,,
521,Запорізький електротехнічний коледж Запорізького національного технічного університету,ЗЕК ЗНТУ,91,34910725,Державна,Міністерство освіти і науки України,Коледж,ЗАПОРІЗЬКА ОБЛАСТЬ/М.ЗАПОРІЖЖЯ,ЗАПОРІЗЬКА ОБЛАСТЬ/М.ЗАПОРІЖЖЯ, ЗАПОРІЖЖЯ, ОРДЖОНІКІДЗЕВСЬКИЙ, 69035: Леніна 194,2330123,zetk@zaporozhye.net,Рябенко Євген Миколайович,директор,,,,
522,Запорізький коледж радіоелектроніки Запорізького національного технічного університету,ЗКР ЗНТУ,91,34910699,Державна,Міністерство освіти і науки України,Відокремлений підрозділ,ЗАПОРІЗЬКА ОБЛАСТЬ/М.ЗАПОРІЖЖЯ,ЗАПОРІЗЬКА ОБЛАСТЬ/М.ЗАПОРІЖЖЯ, ЗАПОРІЖЖЯ, ЖОВТНЕВИЙ, 69095: Леніна 117,061 262 43 22,zkr_zntu@mail.ru,Баршай Ольга Костянтинівна,директор,,,,
523,"Комунальний вищий навчальний заклад ""Запорізький педагогічний коледж"" Запорізької обласної ради","КВНЗ ""ЗПК"" ЗОР",0,2136139,Комунальна,Обласна рада,Коледж,ЗАПОРІЗЬКА ОБЛАСТЬ/М.ЗАПОРІЖЖЯ,ЗАПОРІЗЬКА ОБЛАСТЬ/М.ЗАПОРІЖЖЯ, ЗАПОРІЖЖЯ, ХОРТИЦЬКИЙ, 69097: Запорозького Козацтва 6,(061) 2780739,2249427,kvznzpk@gmail.com,Мельник Олександр Миколайович,директор,,,
